Name	URL	URL to Dataset	Description	Tags
NWB	https://www.nwb.org/example-datasets/	All on DANDI		
OpenNeuro	https://openneuro.org/	https://openneuro.org/	Filtering, >600 datasets, one of best repositories; leans toward fMRI and EEG but also everything	
Dandi	https://www.dandiarchive.org/		One of best repositories; leans toward fine function and structure but also everything else	cell ephys
Spatial Atlas	https://www.spatial-atlas.net/Brain/	https://zenodo.org/records/8327576		RNA-seq,connectome,multimodal
OpenDatasets	https://imaging.mrc-cbu.cam.ac.uk/methods/OpenDatasets		Good meta-repository; includes good description, e.g. giant unification study	ca2+,fMRI,fNIRS,multimodal
MICRONS Explorer	https://www.microns-explorer.org/phase1	https://zenodo.org/records/7510511	mouse EM dataset	
Natural Scenes Dataset	https://naturalscenesdataset.org/	Must fill out form for access: https://docs.google.com/forms/d/e/1FAIpQLSduTPeZo54uEMKD-ihXmRhx0hBDdLHNsVyeo_kCb8qbyAkXuQ/viewform	(used by MedARC and 2023 Algonauts Challenge)	
NeuroTechX dataset curation	https://github.com/NeuroTechX/awesome-bci#brain-databases			
Brain Image Library	https://api.brainimagelibrary.org/web/	https://submit.brainimagelibrary.org/search	brain CONNECTS dataset in the US	
Open Ephys	https://github.com/openlists/ElectrophysiologyData	Most repositories listed are repeats, direct data is listed below		cell ephys
Open EEG	https://github.com/meagmohit/EEG-Datasets			EEG
Allen Open Datasets	https://alleninstitute.org/open-science-tools/	https://portal.brain-map.org/	connectome, transcriptome and calcium! calcium here: https://portal.brain-map.org/explore/circuits/visual-coding-2p	MRI,RNA-seq,ca2+,connectome
NeMO	www.nemoarchive.org	https://portal.nemoarchive.org/search/f?facetTab=cases	Omic data	epigenomics
Flywire	https://flywire.ai/	Requires sign in: https://codex.flywire.ai/	drosophila connectome	connectome
BossDB	https://bossdb.org/	https://bossdb.org/projects	Volumetric database for 3D and 4D neuroscience data, focused on Electron Microscopy and X-ray Micro/Nano Tomography	electron microscopy,x-ray
Neuromorpho	http://neuromorpho.org/	https://neuromorpho.org/MetaData.jsp	Inventory of digitally reconstructed neurons and glia associated with peer-reviewed publications	
1000 Functional Connectomes Project	https://neuinfo.org/data/source/nlx_144428-1/search?q=%2A&l=&per_page=100	http://fcon_1000.projects.nitrc.org/fcpClassic/FcpTable.html	Fully open downloadable database of 1200 resting state fMRI datasets collected from 33 sites around the world	MRI,fMRI
ABA Mouse Brain: CellType Ephys Data	https://neuinfo.org/data/source/nif-0000-00508-4/search?q=%2A&l=	https://neuinfo.org/data/source/nif-0000-00508-4/search?q=*&l=	Mouse brain cell ephys data in various anatomical regions. Databases of neuronal cell types based on multimodal characterization of single cells to enable data-driven approaches to characterization	cell ephys,multimodal
BrainMaps	https://www.brainmaps.org/	https://www.brainmaps.org/datasetslist.php?start=0&sort=1	Interactive, multiresolution next-generation brain atlas that is based on over 140 million megapixels of sub-micron resolution, annotated, scanned images of serial sections of both primate and non-primate brains	MRI,multimodal
(CRCNS) Collaborative Research in Computational Neuroscience	https://crcns.org/data-sets	https://crcns.org/data-sets	Experimental data sets of high quality that will be valuable for testing computational models of the brain and new analysis methods. The data include physiological recordings from sensory and memory systems, as well as eye movement data	EEG,electron microscopy,multimodal
EEGbase	https://neuinfo.org/data/source/nif-0000-08190-1/page/3/search?q=%2A&l=	https://neuinfo.org/data/source/nif-0000-08190-1/page/3/search?q=*&l=	Information related to EEG/ERP research, including data, tools and resources.	EEG
Information eXtraction from Images (IXI dataset)	https://brain-development.org/ixi-dataset/	https://brain-development.org/ixi-dataset/	Nearly 600 MR images from normal, healthy subjects	MRI
ModelDB	https://modeldb.science/	https://modeldb.science/ListByModelName	ModelDB provides an accessible location for storing and efficiently retrieving computational neuroscience models that can be filtered by cell type, network models, pathophysiologies, etc. Mostly computational models	multimodal
NeuronDB	https://senselab.med.yale.edu/neurondb	https://senselab.med.yale.edu/NeuronDB/NeuronList	Dynamically searchable database of three types of neuronal properties: voltage gated conductances, neurotransmitter receptors, and neurotransmitter substances	
COINS	https://coins.trendscenter.org/		Allows for uploading, sharing, and querying of datasets. Includes more than 1,000 ABIDE datasets (including functional and structural imaging data and phenotypic data for the study of autism) and the CoRR dataset, consisting of 1,629 Subjects 3,357 Anatomical Scans, 5,093 Resting Functional Scans, 1,302 Diffusion Scans, 300 CBF and ASL Scans	fMRI,multimodal
NeuroML	https://neuroml-db.org/search_model	https://neuroml-db.org/	Sharing complex, multiscale neuron and neuronal network models; mostly single cell models	
NeuroVault	https://neurovault.org/	https://neurovault.org/collections/?q=	Publicly store and share unthresholded statistical maps, parcellations, and atlases produced by MRI and PET studies. Awful UX unfortunately; many datasets appear to be ~6 fMRI images, unclear if full dataset is stored elsewhere	MRI,PET
NITRC	https://www.nitrc.org/ir/app/template/Index.vm	links to multiple datasets, notable ones linked below (BIRN, 1000 Functional Connectomes Project, Task-based fMRI atlases, )	Image repository (IR) to support NIfTI and DICOM neuroimaging data that is searchable by metadata, such as handedness and gender. Contains over a dozen datasets, with thousands of subjects and imaging sessions	multimodal
Open Source Brain	https://v2.opensourcebrain.org/repositories	https://v2.opensourcebrain.org/repositories	Public repository for detailed neuronal models in standardised formats. Allows for querying. Seems to be all DANDI, I’d remark to low priority	
StudyForrest	https://www.studyforrest.org/data.html	https://openneuro.org/datasets/ds000113/versions/1.3.0/download	MRI data repository that holds a set of 7-Tesla MRI images and behavioral metadata. Housed on OpenNeuro	MRI,fMRI
				
USC Multimodal Connectivity Database	https://umcd.humanconnectomeproject.org/umcd/default/browse	https://umcd.humanconnectomeproject.org/umcd/default/browse	Web-based repository and analysis site for connectivity matrices that have been derived from de-identified neuroimaging data	MRI,fMRI,multimodal
CCF	https://www.humanconnectome.org/study/hcp-young-adult/document/500-subjects-data-release/	Requires account: https://db.humanconnectome.org/app/template/Login.vm	Behavioral and 3T MR imaging data from over 500 healthy adult participants	MRI,fMRI
OASIS	https://www.oasis-brains.org/	"OASIS 1: OASIS 1 Link
OASIS 2: OASIS 2 Link
OASIS 3 and 4: Require account"	Neuroimaging and processed imaging data across a broad demographic, cognitive, and genetic spectrum. There are four different OASIS datasets that require different methods of access. The primary modality is MRI, but each dataset states that it comes with fMRI as well. Also housed on XNAT	CT,MRI,PET,fMRI,multimodal
XNAT	https://central.xnat.org/	https://central.xnat.org/app/template/Index.vm	Contains 396 projects, 7078 subjects, and 16612 imaging sessions. Mainly involves MR, PET, and CT	MRI,PET,fMRI,multimodal,ultrasound
Open NeuroData	https://registry.opendata.aws/open-neurodata/	https://registry.opendata.aws/open-neurodata/	Click on type of modality at top to see datasets        Multiple neuroimaging datasets (as Neuroglancer Precomputed Volumes) across multiple modalities and scales, ranging from nanoscale (electron microscopy), to microscale (cleared lightsheet microscopy and array tomography), and mesoscale (structural and functional magnetic resonance imaging)	MRI,electron microscopy,multimodal
GIN	https://gin.g-node.org/explore/repos	https://doi.gin.g-node.org/	Open data management system designed for comprehensive and reproducible management of neuroscientific data. Contains a very wide variety of datasets	MRI,ca2+,cell ephys,fMRI,multimodal,ultrasound
EBRAINS	https://search.kg.ebrains.eu/?category=Dataset	https://search.kg.ebrains.eu/?category=Dataset	Free and open database of neuroscience data, computational models and software tools	EEG,MRI,ca2+,cell ephys,electron microscopy,fMRI,multimodal
IDA	https://ida.loni.usc.edu/login.jsp		Provides tools and resources for de-identifying, integrating, searching, visualizing and sharing a diverse range of neuroscience data. Contains 151 studies and 97,744 subjects	CT,EEG,MRI,PET,multimodal
PhysioNet	https://physionet.org/content/		Free access to large collections of physiological and clinical data. Contains some neural datasets	CT,EEG,MRI,multimodal
ARDC	https://researchdata.edu.au/search/#!/rows=15/sort=list_title%20asc/class=collection/anzsrc-for=1109/p=1/	https://researchdata.edu.au/search/#!/q=/class=collection/	Provides access to various neuroscience datasets from Australian research institutions. Some require access from the labs	EEG,MRI,electron microscopy,fMRI,multimodal
Brain Catalogue	https://braincatalogue.org/		Shares datasets related to comparative brain anatomy across species. Comparison across species	MRI
NES	https://github.com/neuromat/nes		EEG, EMG, TMS, and generic data collection	EEG
NDA NIMH	https://nda.nih.gov/general-query.html?q=query=featured-datasets:HCP%20Aging%20and%20Development	https://nda.nih.gov/general-query.html?q=query=data-structure ~and~ orderBy=shortName ~and~ orderDirection=Ascending ~and~ resultsView=table-view	Informatics platform that facilitates data sharing across all mental health and other research communities. Repositories currently supported include the NIMH Data Archive (NDA), the Adolescent Brain Cognitive Development Study (ABCD), the Connectome Coordination Facility (CCF), and the NIAAA Data Archive (NIAAA DA) Focuses more on disorders	EEG,MRI,PET,electron microscopy,fMRI,multimodal,x-ray
Radboud Repository	https://repository.ubn.ru.nl/handle/2066/148787/browse?authority=18d54e1539fbf8c32dc7241c9ecf402d&type=authorganizationcode		Holds all datsets from Radboud University, can filter to get cognitive neuroscience and neuroscience datasets	EEG,MRI,fMRI
Knowledge Space	https://knowledge-space.org/	https://knowledge-space.org/search?q=mouse	Thousands of datasets indexed from the world's leading neuroscience data repositories, including OpenNeuro, ModelDB, NeuroMorpho, etc. Can be filtered to look through individual repositories or all at once	EEG,MRI,PET,ca2+,cell ephys,electron microscopy,fMRI,multimodal,ultrasound
Zenodo	https://zenodo.org/		General data repository, can search for e.g. “fMRI”	everything
Brain Cell Data	https://www.braincelldata.org/			
Alzheimer’s Disease Neuroimaging Initiative	https://adni.loni.usc.edu/	Contained in the IDA	MRI and PET images, genetics, cognitive tests, CSF and blood biomarkers as predictors of Alzheimer’s disease	MRI,PET
BIRN fMRI and MRI Data	https://www.nitrc.org/frs/?group_id=64	https://www.nitrc.org/frs/?group_id=64	fMRI, MRI scans and atlases for human and mouse brains	MRI,fMRI
Brede Database				
