Human Connectome Project for Early Psychosis	Academic	Concluded	2016	2016.0	2020	2020.0	$1,431,972		True	National Institute of Mental Health (NIH)	Human	Human	https://reporter.nih.gov/project-details/9108511 	"Early psychosis disrupts brain connectivity;
HCP data reveals structural, functional, and genetic
insights."	"https://pubmed.ncbi.nlm.nih.gov/39036958/

Keywords - Early psychosis, HCP, brain mapping"
The Epilepsy Connectome Project	Academic	Concluded	2015	2015.0	2019	2019.0	$1,205,042		True	National Institute of Neurological Disorders and Stroke (NIH)	Human	Human	https://reporter.nih.gov/project-details/8969005 	"Epilepsy Connectome Project links TLE connectivity
abnormalities to seizures, cognitive decline, and
treatment outcomes."	"https://pmc.ncbi.nlm.nih.gov/articles/PMC11298711/

Keywords - Epilepsy Connectome Project"
Mapping the Human Connectome: Structure, Function, and Heritability	Academic	Concluded	2010	2010.0	2015	2015.0	$6,784,111		True	"National Institute on Aging, Eunice Kennedy Shriver National
Institute of Child Health and Human Development,
National Institute of Mental Health"	Human	Human	https://reporter.nih.gov/project-details/7994562 	"Reveals heritable brain circuit variability, linking
genetics, behaviour, and advanced multimodal
neuroimaging findings."	"https://pmc.ncbi.nlm.nih.gov/articles/PMC10402126/

Keywords - brain connectome, brain mapping"
Connectomics of Brain Aging and Dementia	Academic	Concluded	2016	2016.0	2022	2022.0	$5,967,418		True	National Institute on Aging (NIH)	Human	Human	https://reporter.nih.gov/project-details/9109803 	"AD cognitive decline stems from combined
Alzheimer’s
pathology and vascular changes reducing brain
compensation"	"https://pmc.ncbi.nlm.nih.gov/articles/PMC10947965/

Keywords - Alzheimer's Disease, HCP imaging protocols in Alzheimer's Disease"
UNC/UMN Baby Connectome Project	Academic	Concluded	2016	2016.0	2020	2020.0	$1,060,130		True	"National Institute of Mental Health, National Institute of Neurological
Disorders and Stroke (NIH)"	Human	Human	https://reporter.nih.gov/project-details/9136946 	"Baby Connectome Project mapped early brain
development in babies, linking structural, functional,
and behavioural growth trajectories from birth."	"https://pmc.ncbi.nlm.nih.gov/articles/PMC11025208/

Keywords - Neonatal brain mapping, baby brain connectome, UNC,UMN baby brain connectome"
Amish Connectome Project on Mental Illness	Academic	Concluded	2015	2015.0	2019	2019.0	$1,108,991		True	National Institute of Mental Health	Human	Human	https://reporter.nih.gov/project-details/8969367 	"Amish Connectome Project revealed genetic links to
brain connectivity disruptions driving familial mental
disorder patterns."	"https://pmc.ncbi.nlm.nih.gov/articles/PMC10483025/

Keywords - Brain connectome in older Amish people"
Connectomic imaging in familial and sporadic frontotemporal degeneration	Academic	Concluded	2016	2016.0	2020	2020.0	$1,253,197		True	National Institute on Aging	Human	Human	https://reporter.nih.gov/project-details/9110441 	"FTD connectomic analysis identified distinct tau and
TDP network patterns in familial and sporadic
frontotemporal degeneration."	"https://pmc.ncbi.nlm.nih.gov/articles/PMC11383468/

Keywords - frontotemporal dementia, brain connectome in neurodegenerative disorders"
The Connected Connectome Project	Commercial	Active	2015	2015.0			 5-12 (Approx)	8.5		Simons Foundation	Human, rodents, mouse and fruit fly	Human,Rodents,Insects	https://www.simonsfoundation.org/2021/02/25/the-connected-connectome/ 	"The Connected Connectome Project integrates
multi-species neural data to create a unified brain
connectivity map, advancing neuroscience, AI,
and mental health research."	"
https://en.wikipedia.org/wiki/Flatiron_Institute

Keywords - Simons Foundation, Connectome Project, Flatiron Institute's CCN, brain mapping."
International Brain Laboratory (IBL)	Commercial	Active	2017	2017.0			20	20.0		Simsons Foundation and Wellcome Trust	Mice	Rodents	https://www.internationalbrainlab.com/?utm_source=chatgpt.com 	"The International Brain Laboratory (IBL)studies
decision-making by mapping neuronal activity in mice
using Neuropixels probes, which are capable of
recording 300–1,000 neurons simultaneously across
brain regions."	"https://figshare.com/articles/online_resource/Spike_sorting_pipeline_for_the_International_Brain_Laboratory/19705522?file=49783080

Keywords - IBL spiking rate, neuropixels, brain mapping of mouse"
Scaling Up Connectomics: The Road to a Whole Mouse Brain Connectome	Commercial	Active	2023	2023.0			not specified			Wellcome Trust	Mouse	Rodents	https://wellcome.org/reports/scaling-connectomics	"Developing a comprehensive map of the mouse
brain's neural connections"	"https://www.biorxiv.org/content/10.1101/2024.03.01.582884v1.full

Keywords - neural connections, synaptic reconstruction, LICONN"
The Connectome of Olfactory Memory Circuits in the Adult Fly	Commercial	Concluded	2016	2016.0	2019	2019.0	not specified			Wellcome Trust	Fruitfly	Insects	https://wellcome.org/grant-funding/people-and-projects/grants-awarded/the-connectome-olfactory-memory-circuits-adult-fly	"Creating a connection atlas of the adult fruit fly's
memory centre maps neural circuits to understand
brain function, aiding research on memory and
neural circuit development."	"https://pubmed.ncbi.nlm.nih.gov/32619485/

Keywords - Olfaction, neuroanatomy, Drosophila, memory, synapses"
"Molecular Annotation of the Drosophila Connectome by Optimised
Expansion Microscopy"	Commercial	Concluded	2017	2017.0	2020	2020.0	not specified			Wellcome Trust	Drosophila	Insects	https://wellcome.org/grant-funding/people-and-projects/grants-awarded/molecular-annotation-drosophila-connectome 	"Developed super-resolution techniques to
localize signalling proteins in Drosophila
neurons, enabling detailed molecular annotation
of the connectome and accelerating research
on neural circuit function and development."	"https://www.nature.com/articles/s41586-024-07686-5

Keywords- Molecular annotation of a Drosophila, connectome, multi-connectome cell typing"
"Mapping the energetic pathways of the brain: Ultra-high-field MRI of
cerebral oxygen and glucose utilisation"	Commercial	Active	2020	2020.0			£1,551,810.00	1.98		Wellcome Trust	Human 	Human	"https://wellcome.org/grant-funding/people-and-projects/grants-awarded/mapping-energetic-pathways-brain-ultra-high-field

"	"aims to develop non-invasive methods for mapping
brain oxygen-to-glucose utilisation and tissue oxygen
availability using ultra-high-field magnetic resonance
imaging (MRI)."	"https://cu.converis.clarivate.com/converis/portal/detail/Project/122211577;jsessionid=zAIbucY63IFpcN98xLOy-wkpAdVaXDpogvrKqD_I.cu?lang=en_GB

Keywords - Cardiff University non-invasive brain mapping, "
Mapping the Brain: New Technique Poised to Untangle Complexity	Academic,Commercial	Concluded	"not specified
(possibly late
2000's)"		2011	2011.0	not specified			"Wellcome Trust, European Research Council, European Molecular
Biology Organisation, Medical Research Council, Overseas Research
Students Award Scheme, UCL"	Mouse	Rodents	https://wellcome.org/press-release/mapping-brain-new-technique-poised-untangle-complexity-brain 	"It's focused on the mouse's visual cortex to study
neuronal functions and synaptic connections."	"https://pubmed.ncbi.nlm.nih.gov/21478872/

Keywords - local synaptic connectivity, neocortical networks"
Sainsbury Wellcome Centre for Neural Circuits and Behaviour	Academic,Commercial	Active	2016	2016.0	2025	2025.0	75	75.0		Wellcome Trust, Gatsby Charitable Foundation	Mouse, Zebrafish, 	Rodents,Fish	https://www.sainsburywellcome.org/web/research-news/swc-awarded-major-building-project-year?utm_source=chatgpt.com 	"Researchers focus on understanding the neural
circuits underlying behaviour, with mice being ideal for
studying genetics, neural activity, and behaviour in
controlled experimental settings."	"https://www.cell.com/neuron/fulltext/S0896-6273(18)30144-2

keywords - mouse primary visual cortex, basyesian approach, neuropixels dense silicon probe."
"Controlling epileptic brain networks with computationally optimized weak
electric fields"	Academic	Active	2020	2020.0	2026	2026.0	10.5	10.5		European Commission	Human	Human	https://cordis.europa.eu/project/id/855109 	"GALVANI is a research project aiming to optimize t
transcranial current stimulation (tCS) for epilepsy
 treatment, focusing on personalized protocols,
computational modelling, and seizure prevention in
drug-resistant patients."	"https://www.sciencedirect.com/science/article/abs/pii/S138824572400230X?via%3Dihub

Keywords- Epilepsy, transcranial stimulation, signal processing, stereoelectroencephalography recordings"
Wellcome Centre For Integrative Neuroimaging	Commercial	Active	2017	2017.0			not specified			Wellcome Trust	Human	Human	https://www.ndcn.ox.ac.uk/divisions/fmrib 	"It advances neuroimaging techniques to translate
insights from laboratory neuroscience into applications
 for understanding and treating human brain function
and disorders."	"https://www.mrcbndu.ox.ac.uk/publications/stimulation-evoked-resonant-neural-activity-subthalamic-nucleus-modulated-sleep

Keywords - neural activity, brain stimulation"
