First Author	Year	Organism	Organism (cleaned)	Dataset name	Volume(as quoted)	Volume (μm³)	Volume (claude)	Resolution (nm)	Resolution (claude)	Dataset Size (TB)	Dataset Size (Claude)	Acquisition Time (days)	Scanning Costs ($)	Method	Method (claude)	Completion %	References	Notes
White G.J.	1986	C. elegans	C. elegans	not mentioned	0.0075mm³	7.5 x 10⁶	7500000.0	50	50.0					Serial section TEM	Electron Microscopy	100%	https://pubmed.ncbi.nlm.nih.gov/22462104/	"The Caenorhabditis elegans nervous system consists of 302 neurons arranged in an invariant structure across 118 classes, with highly localized
connectivity and ~5000 chemical synapses, ~2000 neuromuscular junctions, and ~600 gap junctions. Neurons, with simple morphologies, form
connections in defined process bundles, facilitating precise synaptic organization."
Charlie R. Braekevelt	1983	Domestic pig	Other		"retinal regions: ~1mm²
"	Approx. 1,000,000μm³ 	1000000.0	~10−50nm	2.5e-08	not mentioned		not mentioned	not specified	Ultrathin sectioning, transmission electron microscopy (TEM), manual tracing and analysis	Electron Microscopy	"Not mentioned specifically
(partial completion)"	https://link.springer.com/article/10.1007/BF00231355 	"The study describes the ultrastructure of retinal rods and cones in pigs, revealing species-specific differences and advancing
understanding of mammalian photoreceptor anatomy."
John K. Stevens	1980	Rat	Rat	not specified	"∼150×150×50μm³
"	1125000μm³ 	1125000.0	 ~50–100 nm	75.0	~0.1–0.2 TB	0.15	not specified	not specified	"Serial sectioning of retinal tissue, light and electron microscopy, manual tracing of ganglion
cells for circuit reconstruction"	Neuronal Circuit Mapping	100%	https://www.jstor.org/stable/1684192?saml_data=eyJzYW1sVG9rZW4iOiI3NjAwODQwMy01N2YyLTRmMmYtYjRkNi0wNDgyMTI1OTBiZmIiLCJpbnN0aXR1dGlvbklkcyI6WyJjOTcyMDRmZC04ZGZhLTQ1MDMtODA4Yy0xMzc0OGUzNzJmYmIiXX0	"This study provided a foundational view of retinal ganglion cell connectivity, demonstrating early methodologies for functional
architecture analysis in the visual system."
Cyrus Levinthal	1972	"Rotifer (Asplanchna brightwelli) and Crustacean
(Daphnia magna)"	Other	not explicitly named	"Rotifier- 100×50×40μm³;
Daphnia: not specified"	"Rotifier: 200,000μm³
Daphnia: larger but not specified"		10nm 	10.0	not mentioned but <1TB based on techniques available in 1970s	0.5	exactly days not specified (data acquisition spanned months)	not specified	"Serial-section electron microscopy (EM), manual alignment of sections, data
recorded and visualized using custom computational tools"	Electron Microscopy	"Partial: small regions of neuropil
reconstructed for both organisms"	https://www.nature.com/articles/236207a0	"The study introduced methods for aligning and reconstructing neural structures in 3D using EM, combined with early computational tools,
paving the way for modern connectomics. "
